{
 "edition": "2026-09-28",
 "edition_label": "Monday, September 28, 2026",
 "data_through": "Market data as of Sep 25, 2026 close",
 "sections": [
  {
   "title": "Labor Market",
   "rows": [
    {
     "label": "Initial Jobless Claims (000s)",
     "p1": {
      "period": "Wk 9/12",
      "cons": 207,
      "act": 196
     },
     "p2": {
      "period": "Wk 9/19",
      "cons": null,
      "act": 197.0
     },
     "fmt": "k",
     "better": "lower",
     "note": "4-wk avg 203.3K; lowest-since-1969 territory",
     "src": "DOL ETA",
     "url": "https://www.dol.gov/ui/data.pdf",
     "sub": false,
     "needs_review": true,
     "review": [
      "Wk 9/12 revised from 196 to 198.0 \u2014 mention in Notes (Actual stays the first print)",
      "consensus for Wk 9/19 (Bloomberg via First Trust Data Watch \u2192 DJ/LSEG/FactSet named in Notes \u2192 leave null)",
      "update Notes for the new release"
     ]
    },
    {
     "label": "Continuing Claims (000s)",
     "p1": {
      "period": "Wk 9/5",
      "cons": 1779,
      "act": 1730
     },
     "p2": {
      "period": "Wk 9/12",
      "cons": null,
      "act": 1719.0
     },
     "fmt": "k",
     "better": "lower",
     "note": "Lowest since Jan-2024; wk 8/29 rev. to 1,769K",
     "src": "DOL ETA",
     "url": "https://www.dol.gov/ui/data.pdf",
     "sub": false,
     "needs_review": true,
     "review": [
      "Wk 9/5 revised from 1730 to 1717.0 \u2014 mention in Notes (Actual stays the first print)",
      "consensus for Wk 9/12 (Bloomberg via First Trust Data Watch \u2192 DJ/LSEG/FactSet named in Notes \u2192 leave null)",
      "update Notes for the new release"
     ]
    },
    {
     "label": "ADP Private Employment (000s)",
     "p1": {
      "period": "Jul",
      "cons": 75,
      "act": 44
     },
     "p2": {
      "period": "Aug",
      "cons": 47,
      "act": 38
     },
     "fmt": "k",
     "better": "higher",
     "note": "Jul revised to +46K; slowest month since Jan",
     "src": "ADP NER",
     "url": "https://adpemploymentreport.com/",
     "sub": false
    },
    {
     "label": "Nonfarm Payrolls (000s)",
     "p1": {
      "period": "Jul",
      "cons": 80,
      "act": -23
     },
     "p2": {
      "period": "Aug",
      "cons": 55,
      "act": 162
     },
     "fmt": "k",
     "better": "higher",
     "note": "Jul rev. to +21K; Jun+Jul net +55K revision",
     "src": "BLS CES",
     "url": "https://www.bls.gov/news.release/empsit.nr0.htm",
     "sub": false
    },
    {
     "label": "Private Payrolls",
     "p1": {
      "period": "Jul",
      "cons": 78,
      "act": 30
     },
     "p2": {
      "period": "Aug",
      "cons": 45,
      "act": 127
     },
     "fmt": "k",
     "better": "higher",
     "note": "Consensus: LSEG",
     "src": "BLS CES",
     "url": "https://www.bls.gov/news.release/empsit.nr0.htm",
     "sub": true
    },
    {
     "label": "Manufacturing Payrolls",
     "p1": {
      "period": "Jul",
      "cons": null,
      "act": 5
     },
     "p2": {
      "period": "Aug",
      "cons": null,
      "act": 16
     },
     "fmt": "k",
     "better": "higher",
     "note": "No public consensus",
     "src": "BLS CES",
     "url": "https://www.bls.gov/news.release/empsit.nr0.htm",
     "sub": true
    },
    {
     "label": "Unemployment Rate",
     "p1": {
      "period": "Jul",
      "cons": 4.2,
      "act": 4.1
     },
     "p2": {
      "period": "Aug",
      "cons": 4.1,
      "act": 4.1
     },
     "fmt": "pct1",
     "better": "lower",
     "note": "U-6 7.7%; participation 61.6% (Aug)",
     "src": "BLS CPS",
     "url": "https://www.bls.gov/news.release/empsit.nr0.htm",
     "sub": false
    },
    {
     "label": "UMich Consumer Sentiment",
     "p1": {
      "period": "Aug (F)",
      "cons": 51.0,
      "act": 51.7
     },
     "p2": {
      "period": "Sep (P)",
      "cons": 51.0,
      "act": 47.8
     },
     "fmt": "idx",
     "better": "higher",
     "note": "Sep final due Fri 9/25; 1-yr infl. exp. 4.6%",
     "src": "UMich SCA",
     "url": "https://www.sca.isr.umich.edu/",
     "sub": false,
     "needs_review": true,
     "review": [
      "check for a new release since last edition (UMich SCA (sca.isr.umich.edu) \u2014 prelim 2nd Fri, final 4th Fri); if new, shift latest\u2192prior, enter the actual and consensus"
     ]
    },
    {
     "label": "JOLTS Job Openings (000s)",
     "p1": {
      "period": "Jun",
      "cons": 7400,
      "act": 7359
     },
     "p2": {
      "period": "Jul",
      "cons": 7300,
      "act": 7271
     },
     "fmt": "k",
     "better": "higher",
     "note": "Jun revised to 7,182K; Aug due Tue 9/29",
     "src": "BLS JOLTS",
     "url": "https://www.bls.gov/news.release/jolts.nr0.htm",
     "sub": false
    }
   ]
  },
  {
   "title": "Personal / Household Sector",
   "rows": [
    {
     "label": "Consumer Credit ($B)",
     "p1": {
      "period": "Jun",
      "cons": 11.9,
      "act": 14.2
     },
     "p2": {
      "period": "Jul",
      "cons": 11.3,
      "act": 18.1
     },
     "fmt": "b",
     "better": "higher",
     "note": "Nonrevolving +$15.3B, biggest since Jun-2023",
     "src": "Fed G.19",
     "url": "https://www.federalreserve.gov/releases/g19/current/",
     "sub": false
    },
    {
     "label": "Personal Income (MoM)",
     "p1": {
      "period": "Jun",
      "cons": 0.3,
      "act": 0.2
     },
     "p2": {
      "period": "Jul",
      "cons": 0.2,
      "act": 0.4
     },
     "fmt": "pct",
     "better": "higher",
     "note": "Saving rate 3.0% (Jul)",
     "src": "BEA PI&O",
     "url": "https://www.bea.gov/data/income-saving/personal-income",
     "sub": false
    },
    {
     "label": "Personal Spending (MoM)",
     "p1": {
      "period": "Jun",
      "cons": 0.4,
      "act": 0.3
     },
     "p2": {
      "period": "Jul",
      "cons": 0.1,
      "act": 0.2
     },
     "fmt": "pct",
     "better": "higher",
     "note": "Real PCE flat in Jul",
     "src": "BEA PI&O",
     "url": "https://www.bea.gov/data/income-saving/personal-income",
     "sub": false
    },
    {
     "label": "Retail Sales (MoM)",
     "p1": {
      "period": "Jul",
      "cons": 0.1,
      "act": -0.6
     },
     "p2": {
      "period": "Aug",
      "cons": 0.8,
      "act": 1.2
     },
     "fmt": "pct",
     "better": "higher",
     "note": "Strongest month since March",
     "src": "Census MARTS",
     "url": "https://www.census.gov/retail/sales.html",
     "sub": false
    },
    {
     "label": "Ex Auto & Gas",
     "p1": {
      "period": "Jul",
      "cons": null,
      "act": -0.2
     },
     "p2": {
      "period": "Aug",
      "cons": null,
      "act": 1.2
     },
     "fmt": "pct",
     "better": "higher",
     "note": "Ex-autos Aug +1.4% vs +0.6% est.",
     "src": "Census MARTS",
     "url": "https://www.census.gov/retail/sales.html",
     "sub": true,
     "needs_review": true,
     "review": [
      "check for a new release since last edition (Census MARTS release table); if new, shift latest\u2192prior, enter the actual and consensus"
     ]
    }
   ]
  },
  {
   "title": "Industrial & Manufacturing Sector",
   "rows": [
    {
     "label": "Industrial Production (MoM)",
     "p1": {
      "period": "Jul",
      "cons": 0.3,
      "act": 0.2
     },
     "p2": {
      "period": "Aug",
      "cons": 0.3,
      "act": 0.0
     },
     "fmt": "pct",
     "better": "higher",
     "note": "Mfg output \u22120.3% in Aug, first drop of 2026",
     "src": "Fed G.17",
     "url": "https://www.federalreserve.gov/releases/g17/current/",
     "sub": false
    },
    {
     "label": "Capacity Utilization",
     "p1": {
      "period": "Jul",
      "cons": null,
      "act": 76.3
     },
     "p2": {
      "period": "Aug",
      "cons": null,
      "act": 76.3
     },
     "fmt": "pct1",
     "better": "higher",
     "note": "",
     "src": "Fed G.17",
     "url": "https://www.federalreserve.gov/releases/g17/current/",
     "sub": false
    },
    {
     "label": "Durable Goods Orders (MoM)",
     "p1": {
      "period": "Jul",
      "cons": 0.5,
      "act": 1.1
     },
     "p2": {
      "period": "Aug",
      "cons": null,
      "act": 0.0
     },
     "fmt": "pct",
     "better": "higher",
     "note": "Ex-transport Jul +0.4% vs +0.6% est.",
     "src": "Census M3",
     "url": "https://www.census.gov/manufacturing/m3/",
     "sub": false,
     "needs_review": true,
     "review": [
      "Jul revised from 1.1 to 0.9 \u2014 mention in Notes (Actual stays the first print)",
      "consensus for Aug (Bloomberg via First Trust Data Watch \u2192 DJ/LSEG/FactSet named in Notes \u2192 leave null)",
      "update Notes for the new release"
     ]
    },
    {
     "label": "Factory Orders (MoM)",
     "p1": {
      "period": "Jun",
      "cons": 0.2,
      "act": -0.3
     },
     "p2": {
      "period": "Jul",
      "cons": 0.6,
      "act": 0.9
     },
     "fmt": "pct",
     "better": "higher",
     "note": "Ex-transport +0.6% (Jul)",
     "src": "Census M3",
     "url": "https://www.census.gov/manufacturing/m3/",
     "sub": false
    },
    {
     "label": "ISM Manufacturing PMI",
     "p1": {
      "period": "Jul",
      "cons": 53.9,
      "act": 55.6
     },
     "p2": {
      "period": "Aug",
      "cons": 55.2,
      "act": 54.6
     },
     "fmt": "idx",
     "better": "higher",
     "note": "Prices paid 71.1",
     "src": "ISM",
     "url": "https://www.ismworld.org/supply-management-news-and-reports/reports/ism-pmi-reports/",
     "sub": false,
     "needs_review": true,
     "review": [
      "check for a new release since last edition (ISM (ismworld.org) \u2014 1st business day); if new, shift latest\u2192prior, enter the actual and consensus"
     ]
    },
    {
     "label": "ISM Services PMI",
     "p1": {
      "period": "Jul",
      "cons": 54.5,
      "act": 54.1
     },
     "p2": {
      "period": "Aug",
      "cons": 54.1,
      "act": 55.4
     },
     "fmt": "idx",
     "better": "higher",